{
  "schema": "majordomus/generated-artifacts/v1",
  "generated": "GENERATED FILE — DO NOT EDIT DIRECTLY; source: the generation plan itself, over every other target; regenerate with `majordomus generate`",
  "generator": "majordomus-cli 1.0.0-alpha.1",
  "documents": [
    {
      "id": "allow/adr",
      "source": "the document schema `share/schemas/majordomus/adr/adr.v1.proto`",
      "formats": [
        "text"
      ]
    },
    {
      "id": "allow/application",
      "source": "the document schema `share/schemas/majordomus/application/application.v1.proto`",
      "formats": [
        "text"
      ]
    },
    {
      "id": "allow/context",
      "source": "the document schema `share/schemas/majordomus/context/context.v1.proto`",
      "formats": [
        "text"
      ]
    },
    {
      "id": "allow/critique",
      "source": "the JSON Schema `majordomus.critique/v1` of the kind it validates",
      "formats": [
        "text"
      ]
    },
    {
      "id": "allow/current",
      "source": "the JSON Schema `majordomus.current/v1` of the kind it validates",
      "formats": [
        "text"
      ]
    },
    {
      "id": "allow/deployment",
      "source": "the JSON Schema `majordomus.deployment/v1` of the kind it validates",
      "formats": [
        "text"
      ]
    },
    {
      "id": "allow/derive-offload",
      "source": "the JSON Schema `majordomus.derive-offload/v1` of the kind it validates",
      "formats": [
        "text"
      ]
    },
    {
      "id": "allow/distribution",
      "source": "the JSON Schema `majordomus.distribution/v1` of the kind it validates",
      "formats": [
        "text"
      ]
    },
    {
      "id": "allow/document",
      "source": "the JSON Schema `majordomus.document/v1` of the kind it validates",
      "formats": [
        "text"
      ]
    },
    {
      "id": "allow/gap",
      "source": "the JSON Schema `majordomus.gap/v1` of the kind it validates",
      "formats": [
        "text"
      ]
    },
    {
      "id": "allow/intent",
      "source": "the JSON Schema `majordomus.intent/v1` of the kind it validates",
      "formats": [
        "text"
      ]
    },
    {
      "id": "allow/issue",
      "source": "the JSON Schema `majordomus.issue/v1` of the kind it validates",
      "formats": [
        "text"
      ]
    },
    {
      "id": "allow/knowledge",
      "source": "the document schema `share/schemas/majordomus/knowledge/knowledge.v1.proto`",
      "formats": [
        "text"
      ]
    },
    {
      "id": "allow/manifest",
      "source": "the JSON Schema `majordomus.manifest/v1` of the kind it validates",
      "formats": [
        "text"
      ]
    },
    {
      "id": "allow/mesh-declaration",
      "source": "the JSON Schema `majordomus.mesh-declaration/v1` of the kind it validates",
      "formats": [
        "text"
      ]
    },
    {
      "id": "allow/milestone",
      "source": "the JSON Schema `majordomus.milestone/v1` of the kind it validates",
      "formats": [
        "text"
      ]
    },
    {
      "id": "allow/policy",
      "source": "the JSON Schema `majordomus.policy/v1` of the kind it validates",
      "formats": [
        "text"
      ]
    },
    {
      "id": "allow/profile",
      "source": "the JSON Schema `majordomus.profile/v1` of the kind it validates",
      "formats": [
        "text"
      ]
    },
    {
      "id": "allow/project",
      "source": "the JSON Schema `majordomus.project/v1` of the kind it validates",
      "formats": [
        "text"
      ]
    },
    {
      "id": "allow/prompt",
      "source": "the document schema `share/schemas/majordomus/prompt/prompt.v1.proto`",
      "formats": [
        "text"
      ]
    },
    {
      "id": "allow/release",
      "source": "the JSON Schema `majordomus.release/v1` of the kind it validates",
      "formats": [
        "text"
      ]
    },
    {
      "id": "allow/rule",
      "source": "the document schema `share/schemas/majordomus/rule/rule.v1.proto`",
      "formats": [
        "text"
      ]
    },
    {
      "id": "allow/scope",
      "source": "the JSON Schema `majordomus.scope/v1` of the kind it validates",
      "formats": [
        "text"
      ]
    },
    {
      "id": "allow/session",
      "source": "the JSON Schema `majordomus.session/v1` of the kind it validates",
      "formats": [
        "text"
      ]
    },
    {
      "id": "allow/session-context",
      "source": "the JSON Schema `majordomus.session-context/v1` of the kind it validates",
      "formats": [
        "text"
      ]
    },
    {
      "id": "allow/session-record",
      "source": "the JSON Schema `majordomus.session-record/v1` of the kind it validates",
      "formats": [
        "text"
      ]
    },
    {
      "id": "allow/skill",
      "source": "the document schema `share/schemas/majordomus/skill/skill.v1.proto`",
      "formats": [
        "text"
      ]
    },
    {
      "id": "allow/taxonomy",
      "source": "the JSON Schema `majordomus.taxonomy/v1` of the kind it validates",
      "formats": [
        "text"
      ]
    },
    {
      "id": "allow/use-case",
      "source": "the document schema `share/schemas/majordomus/use-case/use-case.v1.proto`",
      "formats": [
        "text"
      ]
    },
    {
      "id": "allow/workspace",
      "source": "the JSON Schema `majordomus.workspace/v1` of the kind it validates",
      "formats": [
        "text"
      ]
    },
    {
      "id": "artifacts",
      "schema": "majordomus/generated-artifacts/v1",
      "source": "the generation plan itself, over every other target",
      "formats": [
        "json",
        "markdown",
        "yaml"
      ]
    },
    {
      "id": "benchmarks",
      "schema": "majordomus/benchmark-matrix/v1",
      "source": "the benchmark projection of the canonical capability registry",
      "formats": [
        "json",
        "markdown",
        "yaml"
      ]
    },
    {
      "id": "capabilities",
      "source": "the canonical Majordomus capability registry",
      "formats": [
        "markdown"
      ]
    },
    {
      "id": "changelog",
      "schema": "majordomus/changelog/v1",
      "source": "the layer's release records, the decisions dated in each release's window, and the commits in its range",
      "formats": [
        "json",
        "markdown",
        "yaml"
      ]
    },
    {
      "id": "cli",
      "schema": "majordomus/cli/v1",
      "source": "the clap declaration in apps/majordomus-cli/src/cli.rs and the examples beside it",
      "formats": [
        "json",
        "markdown",
        "yaml"
      ]
    },
    {
      "id": "deployment",
      "source": ".ai/repo/deployments/majordomus.yaml",
      "formats": [
        "text"
      ]
    },
    {
      "id": "design",
      "schema": "majordomus/design-system/v1",
      "source": "share/design/tokens.yaml, the one declaration of the design",
      "formats": [
        "json",
        "markdown",
        "yaml"
      ]
    },
    {
      "id": "design-declaration",
      "source": "share/design/tokens.yaml, the one declaration of the design",
      "formats": [
        "yaml"
      ]
    },
    {
      "id": "design-logo",
      "source": "share/design/brand/logo.svg, the canonical logo",
      "formats": [
        "text"
      ]
    },
    {
      "id": "design-mark",
      "source": "share/design/brand/logo-mark.svg, the canonical mark",
      "formats": [
        "text"
      ]
    },
    {
      "id": "design-status",
      "source": "share/design/tokens.yaml, the one declaration of the design",
      "formats": [
        "text"
      ]
    },
    {
      "id": "design-surface",
      "source": "share/design/tokens.yaml, the one declaration of the design",
      "formats": [
        "text"
      ]
    },
    {
      "id": "design-theme",
      "source": "share/design/tokens.yaml, the one declaration of the design",
      "formats": [
        "text"
      ]
    },
    {
      "id": "design-tokens",
      "source": "share/design/tokens.yaml, the one declaration of the design",
      "formats": [
        "text"
      ]
    },
    {
      "id": "distribution-matrix",
      "source": "share/distribution.yaml and the release records",
      "formats": [
        "json"
      ]
    },
    {
      "id": "economics",
      "schema": "majordomus/economics-summary/v1",
      "source": "the token-economics methodology and every benchmark run committed under .ai/repo/benchmarks/economics",
      "formats": [
        "json",
        "markdown",
        "yaml"
      ]
    },
    {
      "id": "editors/command",
      "source": "apps/majordomus-cli/src/capability/builtin/intents.rs",
      "formats": [
        "markdown"
      ]
    },
    {
      "id": "editors/domain",
      "source": "module:artifacts",
      "formats": [
        "markdown"
      ]
    },
    {
      "id": "editors/skill",
      "source": ".ai/repo/skills/assess-before-deleting/SKILL.md",
      "formats": [
        "markdown"
      ]
    },
    {
      "id": "editors/zed-tasks",
      "source": "the recipes of the tracked justfile and .just/*.just",
      "formats": [
        "json"
      ]
    },
    {
      "id": "graph",
      "schema": "majordomus/capability-graph/v1",
      "source": "the composed graph of the registry and the index",
      "formats": [
        "json"
      ]
    },
    {
      "id": "graph-schema",
      "source": "the schema of the composed graph, generated from its types",
      "formats": [
        "json"
      ]
    },
    {
      "id": "install-guide",
      "source": "share/install/INSTALL.md.in (the prose) and share/distribution.yaml (every platform, name and URL)",
      "formats": [
        "markdown"
      ]
    },
    {
      "id": "installer",
      "source": "share/distribution.yaml and the release records",
      "formats": [
        "text"
      ]
    },
    {
      "id": "modules/artifacts",
      "source": "the `artifacts` module of the canonical Majordomus capability registry",